{
  "events": [
    {
      "categories": [
        "market",
        "food"
      ],
      "end_at": "2026-10-10T13:00:00-07:00",
      "id": "hillsboro_farmers_markets:downtown@2026-10-10",
      "image_url": "https://images.squarespace-cdn.com/content/v1/5c0063000dbda345c026a656/1775100835391-X7SQWHALKA58HFI7PKZT/LogoMulticolor+%282%29.png",
      "is_all_day": false,
      "listing_url": "https://hillsboromarkets.org/events/cjhxxmdhvuea4ky3x1rjuqvqy0nslu-3lcek-bcgka-hn9ae",
      "organizer": "Hillsboro Farmers' Markets",
      "price": {
        "currency": "USD",
        "is_free": true,
        "max": 0.0,
        "min": 0.0
      },
      "source": {
        "id": "hillsboro_farmers_markets",
        "name": "Hillsboro Farmers' Markets",
        "url": "https://hillsboromarkets.org"
      },
      "start_at": "2026-10-10T09:00:00-07:00",
      "title": "Downtown Hillsboro Saturday Farmers' Market",
      "venue": {
        "address": "150 E Main St, Hillsboro, OR 97123",
        "city": "Hillsboro",
        "latitude": 45.52252,
        "longitude": -122.98929,
        "name": "Downtown Hillsboro Saturday Farmers' Market"
      }
    },
    {
      "categories": [
        "market",
        "food"
      ],
      "end_at": "2026-10-11T14:00:00-07:00",
      "id": "hillsboro_farmers_markets:orenco@2026-10-11",
      "image_url": "https://images.squarespace-cdn.com/content/v1/5c0063000dbda345c026a656/1778104815938-IEZ7W1EIXLZB9OXHJZG4/IMG_1062.jpg",
      "is_all_day": false,
      "listing_url": "https://hillsboromarkets.org/events/orenco-station-sffap-3p8ad-2mjxj-g2tbm-wxjzy-mk9dx-3a62s-5nhxa-pzg45-shg7w-s9eys-dpzs8-7b4gj-l8ym6-s7b68-46sgp-nwssf-phktc-zhmy6-2ywk7-y722y-54f7p",
      "organizer": "Hillsboro Farmers' Markets",
      "price": {
        "currency": "USD",
        "is_free": true,
        "max": 0.0,
        "min": 0.0
      },
      "source": {
        "id": "hillsboro_farmers_markets",
        "name": "Hillsboro Farmers' Markets",
        "url": "https://hillsboromarkets.org"
      },
      "start_at": "2026-10-11T10:00:00-07:00",
      "title": "Orenco Station Farmers' Market",
      "venue": {
        "address": "6125 NE Cornell Rd, Hillsboro, OR 97124",
        "city": "Hillsboro",
        "latitude": 45.53412,
        "longitude": -122.9177,
        "name": "Orenco Station Farmers' Market"
      }
    },
    {
      "categories": [
        "market",
        "food"
      ],
      "end_at": "2026-10-17T13:00:00-07:00",
      "id": "hillsboro_farmers_markets:downtown@2026-10-17",
      "image_url": "https://images.squarespace-cdn.com/content/v1/5c0063000dbda345c026a656/1775100835391-X7SQWHALKA58HFI7PKZT/LogoMulticolor+%282%29.png",
      "is_all_day": false,
      "listing_url": "https://hillsboromarkets.org/events/cjhxxmdhvuea4ky3x1rjuqvqy0nslu-3lcek-bcgka-hn9ae-c885m",
      "organizer": "Hillsboro Farmers' Markets",
      "price": {
        "currency": "USD",
        "is_free": true,
        "max": 0.0,
        "min": 0.0
      },
      "source": {
        "id": "hillsboro_farmers_markets",
        "name": "Hillsboro Farmers' Markets",
        "url": "https://hillsboromarkets.org"
      },
      "start_at": "2026-10-17T09:00:00-07:00",
      "title": "Downtown Hillsboro Saturday Farmers' Market",
      "venue": {
        "address": "150 E Main St, Hillsboro, OR 97123",
        "city": "Hillsboro",
        "latitude": 45.52252,
        "longitude": -122.98929,
        "name": "Downtown Hillsboro Saturday Farmers' Market"
      }
    },
    {
      "categories": [
        "market",
        "food"
      ],
      "end_at": "2026-10-22T20:00:00-07:00",
      "id": "hillsboro_farmers_markets:tanasbourne@2026-10-22",
      "image_url": "https://images.squarespace-cdn.com/content/v1/5c0063000dbda345c026a656/1789575375239-C8CUPIPGU2IG6TDI0IA2/ApplesLogo%231.png",
      "is_all_day": false,
      "listing_url": "https://hillsboromarkets.org/events/streets-at-tanasbourne-gdrn8-bzxpy-saenf-8jgp3-3wjxd-3rwlj-w4xyn-gl7cc-4yrmw",
      "organizer": "Hillsboro Farmers' Markets",
      "price": {
        "currency": "USD",
        "is_free": true,
        "max": 0.0,
        "min": 0.0
      },
      "source": {
        "id": "hillsboro_farmers_markets",
        "name": "Hillsboro Farmers' Markets",
        "url": "https://hillsboromarkets.org"
      },
      "start_at": "2026-10-22T16:00:00-07:00",
      "title": "Harvest Festival at Streets at Tanasbourne Farmers' Market",
      "venue": {
        "address": "The Streets of Tanasbourne, 10050 NW Emma Way, Hillsboro, OR 97124",
        "city": "Hillsboro",
        "latitude": 45.53531,
        "longitude": -122.87894,
        "name": "Streets at Tanasbourne Farmers' Market"
      }
    },
    {
      "categories": [
        "market",
        "food"
      ],
      "end_at": "2026-10-24T13:00:00-07:00",
      "id": "hillsboro_farmers_markets:downtown@2026-10-24",
      "image_url": "https://images.squarespace-cdn.com/content/v1/5c0063000dbda345c026a656/1775100835391-X7SQWHALKA58HFI7PKZT/LogoMulticolor+%282%29.png",
      "is_all_day": false,
      "listing_url": "https://hillsboromarkets.org/events/cjhxxmdhvuea4ky3x1rjuqvqy0nslu-3lcek-bcgka-hn9ae-cc6hx",
      "organizer": "Hillsboro Farmers' Markets",
      "price": {
        "currency": "USD",
        "is_free": true,
        "max": 0.0,
        "min": 0.0
      },
      "source": {
        "id": "hillsboro_farmers_markets",
        "name": "Hillsboro Farmers' Markets",
        "url": "https://hillsboromarkets.org"
      },
      "start_at": "2026-10-24T09:00:00-07:00",
      "title": "Downtown Hillsboro Saturday Farmers' Market",
      "venue": {
        "address": "150 E Main St, Hillsboro, OR 97123",
        "city": "Hillsboro",
        "latitude": 45.52252,
        "longitude": -122.98929,
        "name": "Downtown Hillsboro Saturday Farmers' Market"
      }
    },
    {
      "categories": [
        "market",
        "food"
      ],
      "end_at": "2026-10-25T14:00:00-07:00",
      "id": "hillsboro_farmers_markets:orenco@2026-10-25",
      "image_url": "https://images.squarespace-cdn.com/content/v1/5c0063000dbda345c026a656/1789575558929-0YEY6KA5S8T0SE3IIJMZ/PumpkinWagonLogo%231.png",
      "is_all_day": false,
      "listing_url": "https://hillsboromarkets.org/events/orenco-station-sffap-3p8ad-2mjxj-g2tbm-wxjzy-mk9dx-3a62s-5nhxa-pzg45-shg7w-s9eys-dpzs8-7b4gj-l8ym6-s7b68-46sgp-nwssf-phktc-zhmy6-2ywk7-y722y-54f7p-rc8t4",
      "organizer": "Hillsboro Farmers' Markets",
      "price": {
        "currency": "USD",
        "is_free": true,
        "max": 0.0,
        "min": 0.0
      },
      "source": {
        "id": "hillsboro_farmers_markets",
        "name": "Hillsboro Farmers' Markets",
        "url": "https://hillsboromarkets.org"
      },
      "start_at": "2026-10-25T10:00:00-07:00",
      "title": "Harvest Festival at Orenco Station Farmers' Market",
      "venue": {
        "address": "6125 NE Cornell Rd, Hillsboro, OR 97124",
        "city": "Hillsboro",
        "latitude": 45.53412,
        "longitude": -122.9177,
        "name": "Orenco Station Farmers' Market"
      }
    },
    {
      "categories": [
        "market",
        "food"
      ],
      "end_at": "2026-10-31T13:00:00-07:00",
      "id": "hillsboro_farmers_markets:downtown@2026-10-31",
      "image_url": "https://images.squarespace-cdn.com/content/v1/5c0063000dbda345c026a656/1789575398254-GN8QHIWHG3V2ZM340MXA/PumpkinsLogo%231.png",
      "is_all_day": false,
      "listing_url": "https://hillsboromarkets.org/events/cjhxxmdhvuea4ky3x1rjuqvqy0nslu-3lcek-bcgka-hn9ae-cc6hx-ketn4",
      "organizer": "Hillsboro Farmers' Markets",
      "price": {
        "currency": "USD",
        "is_free": true,
        "max": 0.0,
        "min": 0.0
      },
      "source": {
        "id": "hillsboro_farmers_markets",
        "name": "Hillsboro Farmers' Markets",
        "url": "https://hillsboromarkets.org"
      },
      "start_at": "2026-10-31T09:00:00-07:00",
      "title": "Harvest Festival at Downtown Hillsboro Saturday Farmers' Market",
      "venue": {
        "address": "150 E Main St, Hillsboro, OR 97123",
        "city": "Hillsboro",
        "latitude": 45.52252,
        "longitude": -122.98929,
        "name": "Downtown Hillsboro Saturday Farmers' Market"
      }
    }
  ],
  "generated_at": "2026-10-16T16:33:49+00:00",
  "source_id": "hillsboro_farmers_markets",
  "status": "ok"
}
